id,question_number,lesson_name,lesson_group,topic,year,pdf_name,question_text,option_a,option_b,option_c,option_d,correct_option,difficulty,explanation
d7bd18a3-da57-4a6a-97e0-934d9cbd4b30,1,Türkçe,Genel Dersler,Anlatım Bozukluğu,,sgs_2024_2_lisans_a_grubu_ingilizce.pdf,"“Beni gözünden sakınan, el üstünde tutan, değer veren tek dostumdu o.” cümlesindeki anlatım bozukluğunun nedeni aşağıdakilerden hangisidir?",A) Nesne eksikliği,B) Yardımcı eylem eksikliği,C) Dolaylı tümleç eksikliği,D) Özne eksikliği,A,orta,
ff102d91-8cba-4bec-9b43-7fde4e94f917,2,Matematik,Genel Dersler,Denklemler,,sgs_2024_2_lisans_a_grubu_ingilizce.pdf,"𝒂, 𝒃 ve 𝒄 pozitif tamsayılar olmak üzere; 3𝒂 + 𝒃 + 2𝒄 sayısının çift sayı olduğu biliniyor. Buna göre; I. 2𝑎 + 𝑐 II. 𝑎 + 𝑏 III. 𝑎𝑏 + 𝑎 sayılarından hangisi/hangileri kesinlikle çift sayıdır?",A) Yalnız II,B) Yalnız III,C) I ve II,D) I ve III,C,orta,
0b08e1bf-da20-42e3-9c33-ef1f3d5ffa42,3,Tarih - Genel Kültür,Genel Dersler,Cumhuriyet Dönemi,,sgs_2024_2_lisans_a_grubu_ingilizce.pdf,Cumhuriyetin ilk yıllarında “yabancı okullar sorunu” devleti uğraştıran önemli sorunlardan biri olmuştur. Bu konuda Türkiye hangi ülke ile anlaşmazlık yaşamıştır?,A) İtalya,B) ABD,C) İngiltere,D) Fransa,D,orta,
e2185d4c-58b2-4732-b6a6-d0122b7ff2c0,4,İngilizce,Genel Dersler,Grammar,,sgs_2024_2_lisans_a_grubu_ingilizce.pdf,"In today’s world, there are innovative technologies ---- have changed the idea of producing sustainable energy.",A) who,B) which,C) whose,D) whom,B,orta,
faa25bd6-b536-4f69-8df6-9d0ef1e2a212,5,Mali Tablolar Analizi,Muhasebe,Bilanço,,sgs_2024_2_lisans_a_grubu_ingilizce.pdf,"A iş yerinde çalışanların %25’i, B iş yerinde çalışanların ise %50’si kadındır. Bu iki iş yerinde çalışanların tamamının %40’ı kadın olduğuna göre, A iş yerinde çalışanların sayısının B iş yerinde çalışanların sayısına oranı kaçtır?",A) 1/3,B) 3/5,C) 2/3,D) 3/4,C,orta,
381d18eb-054c-4f83-bb16-dd873442b80f,1,Türkçe,Genel Dersler,Anlatım Bozukluğu,,sgs_2025_1_lisans_a_grubu_ingilizce.pdf,"“Çarpık kentleşme, kentin doğal, kültürel ve tarihsel dokusunu bozuyor, yaşanmaz hâle getiriyor.” cümlesindeki anlatım bozukluğunun benzeri, aşağıdakilerin hangisinde vardır?",A) ...,B) ...,C) ...,D) ...,C,orta,
5b13d19d-009d-4719-a6ff-2a428c01e472,2,Türkçe,Genel Dersler,Noktalama İşaretleri,,sgs_2025_1_lisans_a_grubu_ingilizce.pdf,“Tren bir istasyonda durunca kapı gürültü ile açıldı ( ) Bize ( ) “Ayaklar yukarı ( )” diye bağırdılar ( ) hepimiz emre itaet ettik ( ) İçeriye demirden yapılmış ( ) vagonun zemini uzunluğunda yayvan bir sanduka sürdüler.” Yukarıdaki parçada ayraçlarla ( ) belirtilen yerlere getirilmesi gereken noktalama işaretleri aşağıdaki hangi seçenekte doğru verilmiştir?,A) ...,B) ...,C) ...,D) ...,B,orta,
5654f12b-e471-4bdd-9625-ca49b60b649f,3,Matematik,Genel Dersler,Limit,,sgs_2025_1_lisans_a_grubu_ingilizce.pdf,𝐥𝐢𝐦 𝒏→∞ √𝟐𝟕𝒏𝟓−𝟏𝟔𝒏−𝟏 𝟑 √𝟖𝒏𝟓−𝟏 𝟑 limitinin sonucu aşağıdakilerden hangisidir?,A) −∞,B) 0,C) 27/8,D) 3/2,C,zor,
1ee6a465-7278-4111-93ac-f2d1884cc87d,4,Tarih - Genel Kültür,Genel Dersler,Cumhuriyet,,sgs_2025_1_lisans_a_grubu_ingilizce.pdf,Milletler Cemiyeti (Cemiyet-i Akvam) aşağıdaki konferanslardan hangisinin sonucunda kurulmuştur?,A) Paris Barış Konferansı,B) Londra Konferansı,C) Kahire Konferansı,D) Quebec Konferansı,A,orta,
55ae0e21-6f18-4671-abf5-f38890f3b250,5,İngilizce,Genel Dersler,Grammar,,sgs_2025_1_lisans_a_grubu_ingilizce.pdf,"Visitors ---- present a valid ID when renting a bicycle in the city centre, as per municipal regulations.",A) would,B) must,C) can,D) might,B,orta,
81c25ba0-5266-4c98-b68d-5f4a9b72c32d,6,Mali Tablolar Analizi,Muhasebe,Bilanço,,sgs_2025_1_lisans_a_grubu_ingilizce.pdf,E İşletmesi D A.Ş.’ye ait borsa rayici 6 ₺ olan hisse senetlerinden spekülatif amaçlı olarak 2.000 adet satın almıştır. Bu bilgilere göre E İşletmesinin yapacağı kayıtta aşağıdaki hesaplardan hangisinin kullanımı doğrudur?,A) İştirakler hesabı 12.000 ₺ borçlandırılır.,B) Hisse Senetleri hesabı 6.000 ₺ borçlandırılır.,C) Bankalar hesabı 27.054 ₺ alacaklandırılır.,D) Bağlı Ortaklıklar hesabı 15.000 ₺ borçlandırılır.,B,zor,
d680a0e0-38fd-403d-a42a-26584ef870fa,1,Türkçe,Genel Dersler,anlatım bozukluğu,,sgs_2025_3_lisans_b_grubu_ingilizce.pdf,"Yukarıdaki metinde yazar, düşüncesini geliştirmek için en çok hangi yola başvurmuştur?",A) Tanık gösterme ve alıntı yapma,B) Betimleme,C) Tanımlama,D) Karşılaştırma,A,orta,
2f25db8e-8976-4fec-a502-d1af9df02a2a,2,Matematik,Genel Dersler,oran,,sgs_2025_3_lisans_b_grubu_ingilizce.pdf,Aşağıdaki işlemlerden hangisi yanlıştır?,A) 2 + 2 = 4,B) 3 * 3 = 9,C) 5 - 2 = 3,D) 6 / 2 = 4,D,orta,
ee63f9d8-dc2b-4b21-9064-eac18cbd5be2,3,Tarih - Genel Kültür,Genel Dersler,Osmanlı,,sgs_2025_3_lisans_b_grubu_ingilizce.pdf,Osmanlı Devleti'nin kuruluş tarihi nedir?,A) 1299,B) 1453,C) 1517,D) 1683,A,orta,
7b517ada-517b-46ec-8234-3b8b605bce41,4,İngilizce,Genel Dersler,grammar,,sgs_2025_3_lisans_b_grubu_ingilizce.pdf,Which of the following sentences is correct?,A) She go to school.,B) She goes to school.,C) She gone to school.,D) She going to school.,B,orta,
e8c63137-e1f1-4b44-a5bb-1d4c5b997c53,5,Mali Tablolar Analizi,Muhasebe,bilanço,,sgs_2025_3_lisans_b_grubu_ingilizce.pdf,Bilanço nedir?,A) Gelir tablosu,B) Varlıkların ve yükümlülüklerin listesi,C) Nakit akış tablosu,D) Karşılaştırmalı tablo,B,orta,
3567eb4b-253f-40b2-8bc0-c22e567aaf57,1,Türkçe,Genel Dersler,anlatım bozukluğu,,sgs_2022_1_lisans_a_grubu_ingilizce soru kopyalanmıyor.pdf,Aşağıdaki cümlelerin hangisinde bir anlatım bozukluğu yoktur?,A) ...,B) ...,C) ...,D) ...,C,kolay,
4837ad28-b6cd-4ae3-99b6-abff74cf7a06,2,Matematik,Genel Dersler,oran,,sgs_2022_1_lisans_a_grubu_ingilizce soru kopyalanmıyor.pdf,"Bir 𝑪 noktası,  𝑨𝑩 doğru parçasını |𝑨𝑪|/|𝑩𝑪| = 𝟒 oranında dıştan bölüyor. 𝑨(𝟑, 𝟏), 𝑩(𝟗, −𝟓) olduğuna göre 𝑨𝑩 doğru parçasının orta noktasının 𝑨𝑪 doğru parçasının orta noktasına uzaklığı kaç birimdir?",A) 1,B) 2,C) √2,D) √3,B,orta,
db2b4d21-b3f2-4a9c-a0ad-9d43adf78367,3,Tarih - Genel Kültür,Genel Dersler,Cumhuriyet,,sgs_2022_1_lisans_a_grubu_ingilizce soru kopyalanmıyor.pdf,"Millî Mücadele döneminde aşağıdaki gelişmelerden hangisi, Mustafa Kemal Paşa'nın Samsun'a ayak basması öncesinde gerçekleşmiştir?",A) ...,B) ...,C) ...,D) ...,D,orta,
0b1930bd-d715-48a5-8347-1297a943f967,4,İngilizce,Genel Dersler,grammar,,sgs_2022_1_lisans_a_grubu_ingilizce soru kopyalanmıyor.pdf,The birth of statistics is often dated to 1662 when John Graunt ---- early human statistical and census methods.,A) was developing,B) has developed,C) developed,D) is developing,C,kolay,
32f30aa9-b938-48e2-9735-2c786f241b68,5,Mali Tablolar Analizi,Muhasebe,bilanço,,sgs_2022_1_lisans_a_grubu_ingilizce soru kopyalanmıyor.pdf,Aşağıdaki işlemlerden hangisi muhasebe dışı envanter işlemi değildir?,A) ...,B) ...,C) ...,D) ...,C,orta,
f66aafa6-ea01-4f80-8647-06a7e898b936,1,Türkçe,Genel Dersler,Paragraf,,sgs_2024_1_lisans_a_grubu_ingilizce.pdf,Yukarıdaki numaralandırılmış cümlelerden kurallı ve anlamlı bir paragraf oluşturulmak istenirse paragrafın dördüncü cümlesi aşağıdakilerden hangisi olur?,A) I,B) II,C) III,D) IV,D,orta,
56677503-d6d3-49f0-9329-ff17e1d7a6ed,2,Türkçe,Genel Dersler,Dil Bilgisi,,sgs_2024_1_lisans_a_grubu_ingilizce.pdf,Aşağıdaki cümlelerde altı çizili sözcüklerden hangisi gerçek anlamının dışında kullanılmıştır?,A) Yalnız çocukların değil büyüklerin de merakla beklediği film gösterime girdi.,B) Biriyle tanıştığınızda önce farklılıklarınızı görürsünüz ama zamanla benzerlikleri fark edersiniz.,"C) Kariyeri boyunca bir ödül töreninde, kürsüde konuşma yapmamış nice oyuncu var.",D) Köyün dışındaki bu eski ev kim bilir kaç farklı hikâyeye tanıklık etti.,E,orta,
c748ae93-c033-4dc1-a23a-813f43a72728,3,Matematik,Genel Dersler,Denklem,,sgs_2024_1_lisans_a_grubu_ingilizce.pdf,𝒚 = 𝒆𝒔𝒊𝒏(𝒙𝟐) olmak üzere 𝒅𝒚/𝒅𝒙 (√𝝅) türevinin değeri kaçtır?,A) -2√𝜋,B) -𝜋,C) 1,D) √𝜋,D,zor,
83836a4a-e451-4d03-89ce-1b08dad2e45d,4,Tarih - Genel Kültür,Genel Dersler,Osmanlı,,sgs_2024_1_lisans_a_grubu_ingilizce.pdf,Aşağıdaki gelişmelerden hangisi Osmanlı hanedanının yurt dışına çıkarılmasıyla doğrudan ilgilidir?,A) Saltanatın kaldırılması,B) Lozan Barış Antlaşması’nın imzalanması,C) Cumhuriyetin ilan edilmesi,D) Halifeliğin kaldırılması,A,orta,
c7dead4a-c7f4-4c95-a7cc-c9212853aeca,5,İngilizce,Genel Dersler,Grammar,,sgs_2024_1_lisans_a_grubu_ingilizce.pdf,"Nowadays, modern food preservation techniques ---- the shelf life of food products, significantly reducing waste and improving food security.",A) were extended,B) are extending,C) are extended,D) were extending,C,orta,
e3ce3fc8-894a-4e09-9d7a-7da996ab3680,1,Türkçe,Genel Dersler,Sözcük Türleri,,sgs_2024_3_lisans_a_grubu_ingilizce.pdf,Yukarıdaki şiirde aşağıdaki sözcük türlerinden hangisi yoktur?,A) Ad,B) Belirteç (zarf),C) İlgeç (edat),D) Sıfat,C,kolay,
b9c1c654-1827-469f-a1d0-e74b2b985d44,2,Türkçe,Genel Dersler,Anlatım Bozukluğu,,sgs_2024_3_lisans_a_grubu_ingilizce.pdf,Yukarıdaki sözleri söyleyen kişi aşağıdakilerden hangisini vurgulamaktadır?,A) Özveriyi,B) Birikimi,C) Yeteneği,D) Hayal gücünü,B,orta,
794f135b-fd42-4b8d-8a72-07181fd1ecff,3,Matematik,Genel Dersler,Denklem,,sgs_2024_3_lisans_a_grubu_ingilizce.pdf,"𝑓(𝑥) = 𝑥²(1 − 𝑥³) ile tanımlı 𝑓: ℝ → ℝ fonksiyonunun [0, 1] aralığı üzerinde aldığı en büyük değer ile en küçük değerin toplamı kaçtır?",A) 4/5,B) (3/5)^(1/3),C) 3/5(2/5)^(2/3),D) 2/5,A,zor,
e5b585e9-de7b-4dd8-96c0-6a54a4b051c0,4,Tarih - Genel Kültür,Genel Dersler,Osmanlı,,sgs_2024_3_lisans_a_grubu_ingilizce.pdf,Osmanlı Devleti’nde “Kabakçı Mustafa İsyanı” ile tahttan indirilen padişah aşağıdakilerden hangisidir?,A) III. Selim,B) IV. Mustafa,C) III. Ahmet,D) II. Mahmut,B,orta,
e6f0e1fd-c78d-442d-8759-4a2e83f4649a,5,İngilizce,Genel Dersler,Grammar,,sgs_2024_3_lisans_a_grubu_ingilizce.pdf,Researchers ---- follow strict rules when they do experiments if they need to get accurate and reliable results.,A) had to,B) could,C) would,D) have to,D,kolay,
6b4bc040-a07e-4c6a-a16f-694921afc7ee,6,Mali Tablolar Analizi,Muhasebe,Bilanço,,sgs_2024_3_lisans_a_grubu_ingilizce.pdf,"İşletmenin bankadan 1.10.2024 tarihinde sağladığı 6 ay vadeli, anapara ve faiz geri ödemesi vade sonunda yapılacak krediyle ilgili olarak kredinin kullanıldığı tarih ile bilanço günü arasında geçen günlere ilişkin faiz işletme tarafından hesaplanarak muhasebeleştirilecektir. Bu işlemin muhasebeleştirilmesiyle ilgili aşağıdakilerden hangisi doğrudur?",A) Banka Kredileri hesabının alacak tarafına kayıt yapılır.,B) Finansman Giderleri hesabının alacak tarafına kayıt yapılır.,C) Gider Tahakkukları hesabının alacak tarafına kayıt yapılır.,D) Alınan Avanslar hesabının borç tarafına kayıt yapılır.,C,orta,
d7ca9567-2278-4bf0-8aac-5a8cfcf41e6e,7,Maliye,Finans,Bütçe,,sgs_2024_3_lisans_a_grubu_ingilizce.pdf,"Kamu harcamaları artış oranı %A olmuştur. A, aşağıdakilerden hangisi ise kamu harcamalarında kesinlikle bir “gerçek” artıştan bahsedilebilir?",A) 5,B) 7,C) 10,D) 14,C,kolay,
0e0c1334-1eff-4bd6-a2d0-29d18d79f55f,1,Türkçe,Genel Dersler,Yazım,,sgs_2025_2_lisans_a_grubu_ingilizce.pdf,Aşağıdaki altı çizili ifadelerden hangisinin yazımı yanlıştır?,"A) Zamanın altüst etmediği, er ya da geç sürükleyip götürmediği hiç bir şey yoktur.","B) Günümüzün krizi, hayata anlam ve yön verebilecek her şeyin kopup gitmesidir.","C) Ne yaparsan yap, pişman öleceksin. Belki yaptıklarından, belki de yapmadıklarından.","D) Siz yardım edilmiş yoksullar istiyorsunuz, biz ise ortadan kaldırılmış yoksulluk.",A,kolay,
8ce8c590-02c3-40bb-a67d-992f95f4e090,2,Matematik,Genel Dersler,Denklem,,sgs_2025_2_lisans_a_grubu_ingilizce.pdf,𝑦 = 2𝑥 + 3 doğrusunun eğimi nedir?,A) 1,B) 2,C) 3,D) 4,B,orta,
4504d372-d794-442f-9db9-b5dad01d5780,3,Tarih - Genel Kültür,Genel Dersler,Cumhuriyet,,sgs_2025_2_lisans_a_grubu_ingilizce.pdf,"Mustafa Kemal Paşa, 'Siz orada yalnız düşmanı değil, milletin makûs talihini de yendiniz' sözünü hangi zafer için söylemiştir?",A) 30 Ağustos Zaferi,B) Birinci İnönü Zaferi,C) Dumlupınar Zaferi,D) Sakarya Zaferi,A,kolay,
62928dbd-c383-427d-b912-4b8e1935efd3,4,İngilizce,Genel Dersler,Grammar,,sgs_2025_2_lisans_a_grubu_ingilizce.pdf,"Wooden dolls, which have remained popular ---- centuries, are still made by hand ---- many regions of Eastern Europe.",A) of / on,B) for / in,C) during / at,D) by / of,B,kolay,
9b5c306a-c5c2-4e5a-9f11-32e945e68d07,5,Mali Tablolar Analizi,Muhasebe,Bilanço,,sgs_2025_2_lisans_a_grubu_ingilizce.pdf,Aşağıdaki muhasebe kaydında hangi hesap borçlandırılmalıdır?,A) 102 BANKALAR,B) 649 DİĞER OLAĞAN GELİR VE KÂRLAR,C) 181 GELİR TAHAKKUKLARI,"D) 253 TESİS, MAKİNE VE CİHAZLAR",C,orta,
82b6c60b-57f4-4b66-85e6-989b836ec81a,3,Tarih - Genel Kültür,Genel Dersler,Tarih - Genel Kültür,,sgs_2026_1_lisans_a_grubu_ingilizce.pdf,Osmanlı aile hukukunu düzenleyen Hukuk-ı Aile Kararnamesi aşağıdaki hangi padişah döneminde çıkarılmıştır?,A) III. Selim,B) II. Abdülhamit,C) II. Mahmut,D) V. Mehmet Reşat,C,orta,
4abe6123-2d2e-4947-be17-ea1a40d06372,4,Almanca,Genel Dersler,İşçi,,sgs_2019_2_lisans_a_grubu_almanca.pdf,"4857 sayılı İş Kanunu’na göre, aşağıdaki hâllerden hangisi işverenin eşit işlem yapma borcuna aykırıdır?",A) İşyerinde işe yeni alınan işçi ile aynı konumda çalışan ancak yirmi yıllık kıdemi bulunan işçi arasında kıdem farkı gerekçe gösterilerek farklı düzeyde ücretin ödendiği durum,B) Biyolojik veya işin niteliğine ilişkin sebeplerin zorunlu kılması nedeniyle işverenin iş ilişkisinin kurulmasında işçinin gebeliği nedeniyle farklı işlemde bulunduğu durum,"C) İşyerinde belirsiz süreli iş sözleşmesiyle çalışan işçilerin yılda bir hak kazandığı ikramiyeden, işyerinde altı aylık belirli süreli iş sözleşmesiyle çalışan işçinin çalışma süresi ile orantılı olarak yararlandırılmadığı durumda",D) Biyolojik veya işin niteliğine ilişkin sebeplerin zorunlu kılması nedeniyle işverenin iş ilişkisinin kurulmasında işçinin cinsiyeti nedeniyle farklı işlemde bulunduğu durumda,A,orta,A şıkkı doğrudur çünkü kıdem farkı gerekçe gösterilerek farklı ücret ödenmesi eşit işlem yapma borcuna aykırıdır.
774640c3-e018-49e9-9f12-7a502f9d4f98,2,Türkçe,Genel Dersler,Noktalama,,sgs_2016_2_lisans_a_grubu_almanca.pdf,Ertesi sabah saat 08( )30’da işe koyulmuşlardı( ) İşlerin tamamını bir günde bitirmeleri( ) paketleyip sahiplerine ulaştırmaları mümkün değildi( ) Ayraçla boş bırakılan yerlere sırasıyla aşağıdaki noktalama işaretlerinden hangisi getirilmelidir?,A) (.) (.) (;) (!) ,B) (.) (:) (;) (.),C) (-) (.) (;) (.),"D) (.) (.) (,) (.)",B,orta,B şıkkı doğrudur çünkü cümledeki noktalama işaretleri doğru bir şekilde yerleştirilmiştir.
d4c4db57-8fce-42f8-b539-8eb5f6a969f8,3,Matematik,Genel Dersler,Denklem,,sgs_2016_2_lisans_a_grubu_almanca.pdf,"x = √2 – 1 olduğuna göre, x(x+1)(x+2) çarpımının sonucu kaçtır?",A) -1,B) 0,C) 1,D) √2,B,orta,B şıkkı doğrudur çünkü x değerini yerine koyduğumuzda çarpım 0 çıkmaktadır.
cdf46cea-daea-40ff-be66-25adc730bbc2,4,Tarih - Genel Kültür,Genel Dersler,Cumhuriyet,,sgs_2016_2_lisans_a_grubu_almanca.pdf,"Sivas Kongresi’nde alınan kararları uygulama görevi, aşağıdakilerden hangisine verilmiştir?",A) Felah-ı Vatan Grubu,B) Heyet-i Temsiliye,C) Mebusan Meclisi,D) Ayan Meclisi,B,orta,B şıkkı doğrudur çünkü Sivas Kongresi'nde alınan kararları uygulama görevi Heyet-i Temsiliye'ye verilmiştir.
93bf6d53-ec24-446c-ae78-9b7e245f07bf,5,Mali Tablolar Analizi,Muhasebe,Bilanço,,sgs_2016_2_lisans_a_grubu_almanca.pdf,"İşletme 200.000 TL tutarındaki kârı dağıtma kararı almıştır. Buna göre, hesaplanan I. tertip ve II. tertip yedek akçe tutarı 30.000 TL, ana sözleşme gereğince ayrılacak yedek akçe tutarı 60.000 TL’dir. Kâr dağıtımına ilişkin yapılacak kayıtla ilgili aşağıdakilerden hangisi doğrudur?",A) Statü Yedekleri hesabı 60.000 TL alacaklandırılır.,B) Ortaklara Borçlar hesabı 200.000 TL alacaklandırılır.,C) Yasal Yedekler hesabı 30.000 TL borçlandırılır.,D) Dönem Net Kârı hesabı 200.000 TL borçlandırılır.,C,orta,C şıkkı doğrudur çünkü yasal yedekler hesabı borçlandırılmalıdır.
c0c9c3a6-08bb-4559-9d12-5426cfab3683,1,Türkçe,Genel Dersler,Anlatım Bozukluğu,,sgs_2017_2_lisans_a_grubu_almanca.pdf,"Üvey annem yine gemiyi azıya aldı, beni bir yardan atıp kanıma ekmek doğramak istiyordu. Yukarıdaki cümlede anlatım bozukluğu, aşağıdakilerden hangisi ile giderilir?",A) “yar” sözcüğü yerine “uçurum” sözcüğü kullanılarak,B) “gemiyi” sözcüğü yerine “gemi” sözcüğü kullanılarak,C) “beni” sözcüğü cümleden atılarak,D) “azıya” sözcüğü yerine “azığa” sözcüğü kullanılarak,D,kolay,D şıkkı doğrudur çünkü ‘azıya’ kelimesi yanlış kullanılmıştır.
cf02ae11-04b4-4318-910d-d676336f5385,2,Matematik,Genel Dersler,Denklem,,sgs_2017_2_lisans_a_grubu_almanca.pdf,1/(x-4) = 1/(2x-3) denklemini sağlayan x aşağıdakilerden hangisidir?,A) -1,B) 0,C) 1,D) 2,D,orta,D şıkkı doğrudur çünkü x=2 denklemi sağlar.
7a70baa4-62ae-43ce-98c6-92bc82a2d8a3,3,Tarih - Genel Kültür,Genel Dersler,Cumhuriyet,,sgs_2017_2_lisans_a_grubu_almanca.pdf,Türkiye Cumhuriyeti'nin kuruluş tarihi aşağıdakilerden hangisidir?,A) 1920,B) 1923,C) 1938,D) 1945,B,orta,B şıkkı doğrudur çünkü Türkiye Cumhuriyeti 1923'te kurulmuştur.
e2e4649c-e507-41da-9f95-65f0b1c1ab95,4,Mali Tablolar Analizi,Muhasebe,Bilanço,,sgs_2017_2_lisans_a_grubu_almanca.pdf,Aşağıdaki hesaplardan hangisi bilanço aktifinde yer almaz?,A) Nakit,B) Alacaklar,C) Stoklar,D) Kısa Vadeli Borçlar,D,orta,D şıkkı doğrudur çünkü kısa vadeli borçlar pasifte yer alır.
9b4d5147-26df-4bbd-8d71-4140813d26f4,5,Muhasebe Standartları,Muhasebe,TMS,,sgs_2017_2_lisans_a_grubu_almanca.pdf,"TMS 1'e göre, finansal tabloların sunumunda hangi ilke geçerlidir?",A) Süreklilik,B) Dikkatli Olma,C) Önemlilik,D) Tutarlılık,A,zor,A şıkkı doğrudur çünkü süreklilik ilkesi finansal tabloların sunumunda temel bir ilkedir.
eaa98440-c02c-4dee-b759-f8d6dd54e95b,1,Türkçe,Genel Dersler,Yazım Yanlışları,,sgs_2018_1_lisans_a_grubu_almanca.pdf,Aşağıdakilerin hangisinde yazım yanlışı yoktur?,"A) Çok kibar bir insandı; büyük küçük demez, herkesin hatrını sayardı.",B) Çocuklarını büyütebilmek için verimsiz toprakda çok sıkı çalışıyorlardı.,"C) Önüne patates, samırsak ve lahanadan yapılmış çorbamsı bir yemek kondu.",D) Her iki ailede de evlenmeler ve doğumlar aşağı yukarı aynı zamana raslamıştı.,A,kolay,A şıkkı doğrudur çünkü yazım yanlışı yoktur.
71b185bd-2f11-4c48-893f-9ca16b8c8169,2,Matematik,Genel Dersler,Denklemler,,sgs_2018_1_lisans_a_grubu_almanca.pdf,"Denklemi nx + 2y - 4 = 0 olan doğru (-2,1) noktasından geçtiğine göre, n kaçtır?",A) -3,B) -1,C) 0,D) 1,B,orta,B şıkkı doğrudur çünkü denklemi sağlayan n değeri -1'dir.
be2df2bc-81b2-4529-8843-213a59d29237,3,Tarih - Genel Kültür,Genel Dersler,Osmanlı,,sgs_2018_1_lisans_a_grubu_almanca.pdf,Aşağıdaki padişah-yenilik eşleştirmelerinden hangisi yanlıştır?,A) II. Abdülhamit: Kanun-i Esasi’nin yürürlüğe girmesi,B) Abdülaziz: Sened-i İttifak’ın imzalanması,C) II. Mahmut: Harbiye’nin açılması,D) Abdülmecit: Tanzimat Fermanı’nın ilan edilmesi,B,orta,B şıkkı yanlıştır çünkü Sened-i İttifak Abdülmecit döneminde imzalanmıştır.
06e079d7-bc63-4c21-b37e-9aab8ed22cb1,4,Mali Tablolar Analizi,Muhasebe,Bilanço,,sgs_2018_1_lisans_a_grubu_almanca.pdf,"XYZ A.Ş.’nin genel kurul kararıyla ayrılması gereken yedek tutarını 20.000 ₺’dir. Buna göre, doğru muhasebe kaydı aşağıdakilerden hangisidir?",A) 570 GEÇMİŞ YILLAR KÂRLARI 520 HİSSE SENETLERİ İHRAÇ PRİMLERİ 20.000,B) 570 GEÇMİŞ YILLAR KÂRLARI 540 YASAL YEDEKLER 20.000,C) 570 GEÇMİŞ YILLAR KÂRLARI 331 ORTAKLARA BORÇLAR 20.000,D) 570 GEÇMİŞ YILLAR KÂRLARI 542 OLAĞANÜSTÜ YEDEKLER 20.000,B,zor,B şıkkı doğrudur çünkü yedeklerin ayrılması için doğru kayıt budur.
b6e17738-8d70-4c07-9608-5a9f3a10122d,1,Türkçe,Genel Dersler,Dil Bilgisi,,sgs_2018_2_lisans_a_grubu_almanca.pdf,Yukarıdaki cümleden kesin olarak çıkarılabilecek yargı aşağıdakilerden hangisidir?,A) Yağmur şehirde olumsuzluklara daha önce de yol açmıştır.,B) Daha önce de şehre en az bir kez yağmur yağmıştır.,C) Şehirdeki tüm evler beyaz duvarlıdır ve yağmurdan etkilenmektedir.,D) Şehre her yağmur yağdığında sadece evlerin sıvaları bozulmaz.,B,orta,B şıkkı doğrudur çünkü cümlede daha önce yağmur yağdığına dair bir bilgi vardır.
d6d33488-31e2-48f7-ba71-1bdeb0a6dc26,2,Matematik,Genel Dersler,Denklem,,sgs_2018_2_lisans_a_grubu_almanca.pdf,∑ 𝒏 𝟑𝒏 ∞ 𝒏=𝟏 serisinin toplamı kaçtır?,A) 1/3,B) 1/2,C) 2/3,D) 3/4,B,zor,B şıkkı doğrudur çünkü bu serinin toplamı 1/2'dir.
92f02dd2-2095-4191-af24-b13dad106f83,3,Tarih - Genel Kültür,Genel Dersler,Cumhuriyet,,sgs_2018_2_lisans_a_grubu_almanca.pdf,"Türkiye Cumhuriyeti’nin 1930’lu yıllarda, ekonomik politikada Devletçilik sistemine geçmesindeki neden, aşağıdakilerden hangisidir?",A) Birinci Beş Yıllık Sanayi Planı’nın ekonomiyi olumsuz yönde etkilemesi,B) Lozan Barış Antlaşması’nda Batılı devletlerin bu yönde taleplerinin bulunması,C) Takrir-i Sükûn Kanunu’nun yeni bir sistem öngörmüş olması,D) Özel sektörün ülkenin kalkınmasında yetersiz olduğunun anlaşılması,D,orta,D şıkkı doğrudur çünkü özel sektörün yetersizliği Devletçilik sistemine geçişin nedenidir.
068d7518-4c75-4914-ae75-6c05c88523c7,1,Mali Tablolar Analizi,Muhasebe,Bilanço,,sgs_2019_2_lisans_a_grubu_almanca.pdf,İşletmenin dönem kârından prim de alan bir işletme çalışanının talebi üzerine işletme kârının olduğundan yüksek gösterilmesi aşağıdaki muhasebe kavramlarından hangisi ile çelişmektedir?,A) Özün önceliği,B) Para ile ölçülme,C) Dönemsellik,D) Sosyal sorumluluk,C,orta,C şıkkı doğrudur çünkü dönem kârı ile ilgili muhasebe kavramları arasında çelişki yaratmaktadır.
15ab04c6-74bf-4a94-93c7-34555fa17a5d,2,İktisat,Finans,Talep,,sgs_2019_2_lisans_a_grubu_almanca.pdf,"A kişisinin talep eğrisi Q = 10-2P şeklinde verilmiştir. Buna göre, bu kişi için P* seviyesindeki talep esnekliği -2/3 ise, P* kaçtır?",A) 1/2,B) 2/3,C) 1,D) 3/2,C,orta,C şıkkı doğrudur çünkü talep esnekliği hesaplaması doğru yapılmıştır.
b097a5db-b38c-4171-a530-59452c225288,3,Tarih - Genel Kültür,Genel Dersler,Osmanlı,,sgs_2019_2_lisans_a_grubu_almanca.pdf,"Osmanlı Devleti'nde yenileşme hareketleriyle ilgili aşağıdaki dönemlerden hangisi, diğerlerinden daha önce yaşanmıştır?",A) Tanzimat Dönemi,B) Lale Devri,C) Nizam-ı Cedit Devri,D) II. Meşrutiyet Dönemi,B,orta,"B şıkkı doğrudur çünkü Lale Devri, diğer dönemlerden önce yaşanmıştır."
3b97a85a-a295-4e34-9d0c-e3c60b1ce303,1,Türkçe,Genel Dersler,Dil Bilgisi,,sgs_2020_1_lisans_a_grubu_almanca.pdf,"Arapçadan dilimize giren ve özgün biçimlerinde sonunda ikiz ünsüz bulunan sözcükler, Türkçede tek ünsüzle kullanılır. Bu sözcüklerden hangisi bu özellikte değildir?",A) Şer,B) His,C) Hâl,D) Haz,B,kolay,B şıkkı doğrudur çünkü 'His' kelimesi ikiz ünsüz içermemektedir.
dc5484a3-2c1a-4921-ab07-d728a93e77eb,2,Matematik,Genel Dersler,Denklem,,sgs_2020_1_lisans_a_grubu_almanca.pdf,"A + B = C, C - D = 20, D + E = B toplama işlemleri veriliyor. Bu işlemlere göre; A + E aşağıdakilerden hangisidir?",A) 15,B) 20,C) 25,D) 30,C,orta,C şıkkı doğrudur çünkü verilen denklemlerden A + E = 25 bulunur.
fb066b49-602d-47b3-b917-2532f783fa71,3,Tarih - Genel Kültür,Genel Dersler,Osmanlı,,sgs_2020_1_lisans_a_grubu_almanca.pdf,"Mondros Mütarekesi sonrasında önce İngiltere, daha sonra da Fransa tarafından işgal edilen yer aşağıdakilerden hangisidir?",A) Antep,B) Musul,C) Kars,D) Trabzon,B,orta,"B şıkkı doğrudur çünkü Musul, Mondros Mütarekesi sonrasında işgal edilmiştir."
c7516e1f-15b9-4b9d-89af-b44876e48a72,4,Mali Tablolar Analizi,Muhasebe,Bilanço,,sgs_2020_1_lisans_a_grubu_almanca.pdf,Aşağıdakilerden hangisi aktifi düzenleyici hesaplara bir örnektir?,A) Ödenmemiş Sermaye,B) Gelecek Yıllara Ait Giderler,C) Gider Tahakkukları,D) Dönem Net Zararı,A,zor,"A şıkkı doğrudur çünkü Ödenmemiş Sermaye, aktifi düzenleyici hesaplar arasında yer alır."
