id,question_number,lesson_name,lesson_group,topic,year,pdf_name,question_text,option_a,option_b,option_c,option_d,correct_option,difficulty,explanation
5ad8f246-005c-4715-b3b8-ac7ee39941e0,5,Muhasebe Standartları,Muhasebe,TMS,,sgs_2020_1_lisans_a_grubu_almanca.pdf,"TMS 16 Maddi Duran Varlıklar standardına göre, ilk muhasebeleştirme sonrası maliyet modelini benimseyen bir işletme, maddi duran varlıklarını finansal tablolarda hangi değer üzerinden göstermelidir?",A) Gerçeğe uygun değer (-) Birikmiş amortisman,B) Satın alma bedeli (-) Birikmiş amortisman,C) Gerçeğe uygun değer (-) Birikmiş değer düşüklüğü zararları,D) Maliyet bedeli (-) Birikmiş amortisman,B,zor,B şıkkı doğrudur çünkü TMS 16'ya göre maddi duran varlıklar satın alma bedeli üzerinden gösterilir.
d76d1434-8213-43d7-a37c-dc81fb40254a,1,Türkçe,Genel Dersler,Anlam Bilgisi,,sgs_2020_3_lisans_a_grubu_almanca.pdf,Yukarıdaki paragrafta aşağıdakilerden hangisi yoktur?,A) Ünsüz düşmesi,B) Ünsüz benzeşmesi,C) Ünlü düşmesi,D) Kaynaştırma ünsüzü,C,orta,C şıkkı doğrudur çünkü paragrafta ünlü düşmesi ile ilgili bir örnek yoktur.
e5aed3ff-209e-4663-b8b7-0b909b01076f,2,Matematik,Genel Dersler,Denklemler,,sgs_2020_3_lisans_a_grubu_almanca.pdf,2x+y = 8 ve 3x = 9y ise x sayısı kaçtır?,A) -2,B) -1,C) 0,D) 1,D,zor,D şıkkı doğrudur çünkü denklemler çözülünce x=1 bulunur.
daa337a4-fa9b-4b96-af3d-e6008cf635df,3,Mali Tablolar Analizi,Muhasebe,Bilanço,,sgs_2020_3_lisans_a_grubu_almanca.pdf,Aşağıdakilerden hangisi bilanço kalemlerinden biri değildir?,A) Aktif,B) Pasif,C) Gelir Tablosu,D) Stok,C,orta,C şıkkı doğrudur çünkü gelir tablosu bilanço kalemi değildir.
3d8951ab-cbee-4e51-8ce0-0c33336e4ff8,4,Tarih - Genel Kültür,Genel Dersler,Cumhuriyet Tarihi,,sgs_2020_3_lisans_a_grubu_almanca.pdf,Aşağıdakilerden hangisi Cumhuriyet döneminde kurulan partilerden biridir?,A) Demokrat Parti,B) Adalet Partisi,C) Milliyetçi Hareket Partisi,D) Cumhuriyet Halk Partisi,A,kolay,"A şıkkı doğrudur çünkü Demokrat Parti, Cumhuriyet döneminde kurulmuştur."
5b2dcf3d-0439-4453-8908-ab0fd55bfa15,5,İngilizce,Genel Dersler,Grammar,,sgs_2020_3_lisans_a_grubu_almanca.pdf,Which of the following is correct?,A) He go to school,B) He goes to school,C) He going to school,D) He gone to school,B,orta,B şıkkı doğrudur çünkü doğru cümle yapısıdır.
8bc98e00-335e-41ce-9b0c-341c78427d39,1,Türkçe,Genel Dersler,Yazım,,sgs_2021_2_lisans_a_grubu_almanca.pdf,Aşağıdaki cümlelerin hangisinde terim kullanımı vardır?,"A) Yazdıklarımda, toplumsal sorunları hep başka bir açıdan ele almaya çalıştım.",B) Karşı apartmandan yükselen gürültüler hepimizin kulağını tırmalıyordu.,"C) Bu yeni fikirleri iyice tanıtmalı, en kısa sürede dünyaya yaymalıyız.","D) Annem, ekşi yoğurdu ayran yaparak değerlendirebileceğimizi söylerdi.",E,kolay,E şıkkı doğrudur çünkü terim kullanımı vardır.
f6aaf1b8-7cba-4362-bd44-513854c514a0,2,Matematik,Genel Dersler,Denklem,,sgs_2021_2_lisans_a_grubu_almanca.pdf,𝒙 ≠ 𝟎 reel sayı olmak üzere; 𝟏 + 𝟏/𝒙 = 𝟐𝒙 denklemini sağlayan 𝒙 sayılarının toplamı aşağıdakilerden hangisidir?,A) -2,B) -1/2,C) 1/2,D) 1,C,orta,C şıkkı doğrudur çünkü denklemi sağlayan x değerleri 1/2'dir.
a8b6fd92-f983-43c9-9231-be7ca837de5d,3,Tarih - Genel Kültür,Genel Dersler,Osmanlı,,sgs_2021_2_lisans_a_grubu_almanca.pdf,"Osmanlı Padişahı II. Mahmut ile ayanlar arasında 1808 yılında imzalanan belge, aşağıdakilerden hangisidir?",A) Tanzimat Fermanı,B) Sened-i İttifak,C) Islahat Fermanı,D) Teşkilat-ı Esasiye Kanunu,B,orta,B şıkkı doğrudur çünkü Sened-i İttifak bu tarihte imzalanmıştır.
9571596a-c698-4f5f-ae51-c2a7a00cb6b4,4,Mali Tablolar Analizi,Muhasebe,Bilanço,,sgs_2021_2_lisans_a_grubu_almanca.pdf,"Bir işletmenin dönem sonunda varlıkları, borçlarından 6.000 ₺ fazladır. İşletmenin dönem sonunda varlıkları 15.000 ₺, borçları ise 10.000 ₺ olduğuna göre işletmenin kâr veya zararı kaç ₺’dir?",A) 500 ₺ kâr,B) 1.000 ₺ zarar,C) 1.500 ₺ zarar,D) 2.000 ₺ zarar,A,zor,A şıkkı doğrudur çünkü varlıklar ve borçlar arasındaki fark kârı gösterir.
90c05325-a243-4669-93ce-118e34b86220,5,Muhasebe Standartları,Muhasebe,TMS,,sgs_2021_2_lisans_a_grubu_almanca.pdf,"TMS 1 Finansal Tabloların Sunuluşu standardına göre, aşağıdakilerden hangisi yeniden sınıflandırma düzeltmesi gerektiren bir işlemdir?",A) Maddi olmayan duran varlığın yeniden değerleme artış işlemi,B) Maddi duran varlığın yeniden değerleme artış değişimi,C) Yurtdışındaki bir işletmenin elden çıkarılması,D) Tanımlanmış fayda planlarının yeniden ölçülmesi,B,orta,B şıkkı doğrudur çünkü maddi duran varlıkların yeniden değerlemesi gerektirir.
e66670e4-b210-45df-93b4-4f2705f773ec,1,Türkçe,Genel Dersler,Anlatım Bozukluğu,,sgs_2022_3_lisans_a_grubu_almanca KOPYALANMIYOR.pdf,Aşağıdaki cümlelerin hangisinde anlatım bozukluğu vardır?,A) ...,B) ...,C) ...,D) ...,C,orta,
d2984461-9c4e-4ddd-a42b-3b1d302be3a0,2,Türkçe,Genel Dersler,Yazım Yanlışı,,sgs_2022_3_lisans_a_grubu_almanca KOPYALANMIYOR.pdf,Aşağıdakilerin hangisinde yazım yanlışı yoktur?,A) ...,B) ...,C) ...,D) ...,D,kolay,
9151fc7c-1cd4-4a22-9621-1a849a20c5d6,3,Matematik,Genel Dersler,Geometri,,sgs_2022_3_lisans_a_grubu_almanca KOPYALANMIYOR.pdf,Alanı 16 cm2 olan bir ikizkenar dik üçgenin çevresi kaç cm’dir?,A) 8√2 + 8,B) 8√2 + 4,C) 8√2,D) 4√2 + 4,A,zor,
014e8406-354f-401b-aad9-4e487d7fe9ff,4,Tarih - Genel Kültür,Genel Dersler,Cumhuriyet,,sgs_2022_3_lisans_a_grubu_almanca KOPYALANMIYOR.pdf,"Aşağıdakilerden hangisi, 23 Nisan 1920'de açılan Birinci TBMM'nin özellikleri arasında yer almaz?",A) ...,B) ...,C) ...,D) ...,E,orta,
575da450-d2a8-461c-8f44-592dc28230b4,5,İngilizce,Genel Dersler,Grammar,,sgs_2022_3_lisans_a_grubu_almanca KOPYALANMIYOR.pdf,Which of the following sentences is grammatically correct?,A) ...,B) ...,C) ...,D) ...,B,kolay,
69b06e75-209c-4ada-80ba-fa8fc7a19080,1,Türkçe,Genel Dersler,Anlatım Bozukluğu,,sgs_2023_2_lisans_a_grubu_almanca.pdf,Aşağıdaki cümlelerden hangisinde anlatım bozukluğu vardır?,A) Cümle A,B) Cümle B,C) Cümle C,D) Cümle D,C,orta,
348ef1e5-cd66-48c2-84fc-6fcc9263643c,2,Matematik,Genel Dersler,Denklem,,sgs_2023_2_lisans_a_grubu_almanca.pdf,x + 5 = 10 denkleminin çözümü nedir?,A) 5,B) 10,C) 15,D) 20,A,orta,
02097e7c-e2ab-4fd5-8e44-b6bad9d55f7a,3,Tarih - Genel Kültür,Genel Dersler,Cumhuriyet,,sgs_2023_2_lisans_a_grubu_almanca.pdf,Cumhuriyetin ilanı hangi yılda olmuştur?,A) 1920,B) 1923,C) 1925,D) 1930,B,orta,
a48d3a26-8696-43f7-9fe3-48cf1b75674f,4,İngilizce,Genel Dersler,Grammar,,sgs_2023_2_lisans_a_grubu_almanca.pdf,Which sentence is correct?,A) She go to school.,B) She goes to school.,C) She gone to school.,D) She going to school.,B,orta,
ee45d8d8-3541-4740-bba5-b37ec9eb43bd,5,Mali Tablolar Analizi,Muhasebe,Bilanço,,sgs_2023_2_lisans_a_grubu_almanca.pdf,Bilanço nedir?,A) Gelir tablosu,B) Varlık ve borçların listesi,C) Nakit akış tablosu,D) Karşılaştırmalı tablo,B,orta,
